id,subreddit,keyword,text
12uexe8,delta8,pain,It's so hard to open these jars. It takes 2 screwdrivers to pry it apart. I have an arm injury and this is just painful to get into. What if someone has arthritis? I don't think I'll order from them again just cause of the lids.
12zz4d2,entwives,"afraid,stress,worry","My friend's college aged daughter has decided she no longer wants George, her 4 year old neutered cat. A cat who'd been with her since kittenhood! He's currently living at my friend's going on 2 months now, but their household already holds 3 adults, 5 children and a large, friendly and playful dog that unfortunately just doesn't get that George is *terrified* of him. So George lives a stressed and secluded life, has lost a lot of weight, and my friend has yet to find him a new home.

I myself have just moved into a small basement about a month ago, living solo for the first time since 2014 after years of room mates and relationships. I have had some mental health issues the last few years and at times struggled to do laundry or dishes etc. I've progressed but things are still bad sometimes. When I got my next cat, I already knew I wanted to get a rescue or adult cat. And here is George. But I'm afraid of the big responsibility, I haven't had my own cat since 2013. Should I adopt George? He's a gentle sweetheart but I worry I won't be a good home for him or something haha...  is it a sign? Are George and I destined to be? (Sorry if this doesn't go here, but figured this group would be honest with me in the nicest way!)"
1cdk2f9,leaves,dream,"After I turned 18, my first bf introduced me to weed. At first it was only here and there but soon it became everyday. Flash forward to when I’m 22, my dad passed unexpectedly and two months after he passed I went cold turkey. I made it almost a year and that whole time everyone was telling how proud they were of me and how happy they were for me. But I was miserable. I just dreamed of getting high everyday and it made me even madder people thought it was doing my best when I wasn’t. So I decided f it I’ll just smoke this joint tonight with my friend cause they wanna smoke with me. We’re not friends anymore, and I’ve been a mining every day multiple times a day. I want to actually quit and feel like it improved my life like a lot of people in this sub, but I’m not sure why I feel even more depressed and sad when I’m not smoking. 

Advice, thoughts? 

Thank you for answering"
1e5mbhs,Marijuana,anxiety,"I usually smoke once a day for chronic anxiety. It really has helped compared to my medication. My anxiety has improved and I was thinking of switching to a tincture for a few days a week. 

What works for you guys?"
1g8saso,leaves,"can't move,insomnia,sleep","I have been struggling to quit for a few years. In the last 4 1/2 years I have gotten to 9 days twice and to 1-8 days about 5 times. I am getting sooo tired of going through those first few days of awful depression and insomnia over and over. 3 days, 5 days, 6 days, 9 days etc etc just to fall back into doing it everyday for weeks or months before I manage to get one day in without it.

It took a lot of begging and pleading but I got the person to finally start keeping everything in their bedroom, not smoking outside of their bedroom, and I even got them to stop asking me to hang out and watch tv while they are stoned. But I STILL CAN'T STOP!

The reason why I can't stop is because it is just so accessible. The best advice we give eachother here on this sub is erase your dealer's number, throw away any remnants, and don't be around people who smoke. Well I can't do that because it's in my home. After going 9 days and getting so far and I should be so proud of myself, all it takes is one bad night of insomnia from meds I take for a chronic illness or one bad doctor appointment where I get bad news when I was hoping for good news, or an awful incident at work, or even just getting annoyed by the smoker who lives here because they quite literally promise they are quitting everyday for me to just give in and do it. I KNOW IT WOULDN'T HAPPEN IF IT WASN'T IN MY HOUSE!

I am at my wits end. Tears, depression, feeling like a failure. I don't want this crap in my house and I don't want to even be around anyone who regularly uses it! I am fed up with myself and have lost respect for myself. I can't sustain abstinence long term if it's always in my house and the person who lives with me literally makes it a part of everything. I might have to move but it's just not the best idea right now due to multiple factors. And honestly, the only way to get myself to a point where I can move, is to quit smoking completely so it is no longer negatively impacting my life.

I am so sick and tired of this. I even wish I could just go stay at a motel for a month or something to just at the very least get myself to 30 days so it is less tempting and I have a stronger foundation. But I work from home with a huge computer and a huge monitor that I can't just lug to and set up at a motel, and coming home to work from home while staying in a hotel to avoid weed makes no sense when the smoker I share an apartment with also works from home 3-4 days a week. (He doesn't smoke while working but his ritual process starts once work is over. And he smokes all weekend. And I am more than welcome to grab some, it is very very available, and if I went to a motel and came home to work, there would certainly be weed all around my apartment)

So I really can't move right now. To get myself together to a point where I can move, I need to stop smoking. But just knowing it is in my apartment and readily available, stops me from quitting. I am struggling so bad and I really really need it to not be in my house. Quitting is so difficult because it's really strong stuff and I am physically dependent on it and literally cannot sleep when I try to quit and even my therapist thinks weed withdrawals are mostly mental (Yup! I am laying in bed for 8 hours unable to sleep and it's ""mental"") 

The worst part is when we moved in together, they lied through their teeth and told me that they ""rarely smoke weed""  but they actually do it every single day and their life basically revolves around it. And they just kept promising to quit over and over. I wish they would just say ""Hey, I smoke everyday and I always will."" They still promise they are quitting and they have done it every single day for at least 6 years!!! They don't take my desires to quit seriously, and they seem more than happy to have someone else to sit around with them and do nothing except watch tv and eat junkfood.

Does anyone have any advice for how to overcome this? How to quit when it's in your house? I know the best option is to move, but I'm just not in that position right now and I need to stop smoking before I can get in that position. How can I seperate myself from it when it is in my house?"
1goa81z,vaporents,sleep,"Hello Reddit,

I switched to dry herb vaping in July with an Arizer Air Max after hearing great things. But after months of use, I’m still not impressed and wonder if I bought the wrong vaporizer or if I’m doing something wrong.

Here are my main issues:

•	⁠Flavour: Everything tastes the same—like vaping grass—even with high-quality weed (both THC and CBD). I’ve tried top-shelf and homegrown flower from my cousin, who’s a seasoned grower, and still no improvement.

•	⁠Effects: CBD makes me a bit sleepy, but nowhere near as effective as ingesting ABV. THC lacks the ‘brain disconnect’ I get from smoking.

I’ve read others had similar issues and switched to the Mighty with better results. Since most vaporizers use similar heating methods, is it really just the device?

Any advice would be appreciated!

Thanks!"
1gy6abe,420,"sleep,worry","I know a truck driver that keeps a one hitter in his travels, very safe and reasonable person. But anyways, he claims he has just had literally one or 2 tokes every day or every other day and has never failed a test. He's a skinny guy that doesn't eat much, he has a high metabolism oi suppose? But it got me thinking if that *is* possible, then I could have a much better quality of life myself, I still live in a restricted state, but I'd sure love to be able to unwind with a toke or 2 and not worry about losing my job. I'm built like that fella and definitely have a high metabolism, I've never been able to gain weight. I quit the alcohol because it was ruining everything, so I haven't had a drink in a couple years now. Thank god for that. It just pisses me off that you can drink like a fish all night and still keep your job, but naturally medicating your sore muscles and sleep patterns, you are gonna be unemployed. Please advise me, I appreciate any feedback. "
1h59w0t,CBD,sleep,"Hello,

I've been taking a CBD tincture isolate to help me fall asleep. I started with 25mg, but that wasn't quite strong enough so I've since bumped it up to 50mg. It has drastically improved my quality of sleep.

That being said, I've started noticing that I wake up with shaky hands to the point that it's a bit difficult to write and do other things that require fine motor movements. Is this a side effect of the CBD? I've tried looking it up, but unfortunately all I can find are articles stating that it's a side effect of high doses of THC which I avoid (it unfortunately doesn't agree with me anymore.) I also don't recall this being a side effect of THC for me when I still used it, but it has been a few years so I could be wrong.

Thank you in advance for your help!"
1il4rdd,saplings,"nap,panic,worry","so i tried out a pen for the first time with a friend and had the worst experience ever. i was told to do about 2 hits but i did 3 since i thought i had fucked up the first one. immediately after i got high and had a panic attack and started sobbing and apologizing profusely to my friend who didn’t get high and had to worry and take care of me.. 

my other friends who had done it already said it was a chill and fun time, but i genuinely felt like i was trippin tf out. is that normal or did i do too much?? i called my friend and asked when it would wear off and he said like an hour but i was high even after a 3 hour nap so?? "
1jgcvio,Petioles,pain,"Hey guys, 25m here quitting after 6 years straight due to health conditions. I believe I have CHS, and I need to find out if I actually do or if it’s something else, but this is the easiest thing to rule out before spending a lot on testing. I’m just sick of constantly having my stomach in pain. I know it’ll be hard, but I can go the 90 days. After that? We’ll see how I’m feeling, but if I do go back, I’ll have a different relationship with weed and not go back to my old self, even if i don’t have CHS. Idk what to expect, but I’m telling myself it’ll be easier than Nicotine and the antidepressants I quit. I gave everything to my brother and told him to hold onto it for at least 90 days. I plan to just stay busy by working out more (like I’ve wanted to), journaling and once it’s nice out I’ll be living at the skatepark again. Idk, I just want to feel normal again and not be in pain. "
1ji7e5s,CBD,"bedtime,nightmares","My partner has pretty bad chronic nightmares. We've tried a few things and CBD is the next experiment on the list after prescription meds and changes in bedtime routines. 

She is very strong on not wanting anything with THC in it, nothing with inebriative properties. I found a few options from the reputable seller list on this sub, But theyre all running $50-60 for a 30 day supply and thats a lot to spend on something that might not actually work. 

TLDR: Looking for a reputable but more affordable sample of CBD (no-THC) supplements for my partner to try and treat her chronic nightmares 

thanks! "
1k5pnja,Marijuana,"anxiety,anxious,pain","Hi I am 20 Male and recently I have been having chest and arm pain. I smoke everyday, I smoke mainly carts and dispensary level carts no fake stuff. 

I have recently as of like a week ago got this chest pain and arm pain and first I thought i was having a heart attack. I went hours and than went to the hospital. We found out everything all the tests were fine ekg, x rays the whole 9 were looking good. I have seen other doctors and they say it is panick attacks but I feel it constantly. I tried periods of not smoking weed and i felt the symptoms still im not sure if this is something that takes time or takes a long break from weed Im willing to anything to get my head out of this funk and body feeling normal. I am also a little overweight but I dont undertand whats happening. Im generally an anxious person but this isnt normal anxiety. 

If any of you have felt this feeling and made it out ok thats what I wanna hear and what success stories you had let me know.

Update: after doing more research i found it may be linked to the doxycycline i have been taking. Currently going to get off that and see what happens if anyone has had any bad experiences with doxycycline lmk what you did to heal and feel better"
1kgp55k,delta8,"anxiety,sleep","I want to buy a lightweight pen, to chill listen to music, do some work, but not put me to sleep nor give me anxiety. What do u recommend? "
1kn4n21,Petioles,"anxiety,sleep,slept","I'm a 29 F, and I've been smoking on and off for the last 10 years. Ive taken tons of breaks, lasting anywhere from a day, and even extending past a year. 

Recently, I decided to officially quit bc I noticed it was causing me tons of issues: poor memory, truoble recalling words, terribly dry skin, raised anxiety, disturbed sleep, ect

Its been 4 months, 3 weeks and 2 days, and I still don't quite feel like myself. My vocabulary has started coming back, but my personality has seemed to dull in social situations. Where I once had responses to things, my mind is terribly blank  and my responses very basic. Its extremely hard for me to connect with others 

Its a little hard for me ro fully remember myself before the weed, but I know for sure I was lighter, more positive, and extremely good at connecting with others, atleast on a 1 to 1 basis. 

I also want to add in that I havnt fully fixed my sleep cycle and have been battling to do so since I quit weed. Using it so heavily (multiple times a day) has caused me to feel extremely tired in general and I did go through a 5 year period where I slept maybe 3 hours a night, and that was if I was lucky. 

My sleep has generally improved since then, but ive had to use trazadone to help me. Even with the medication, I don't get nearly the quality I did during my childhood all the way to my mid 20s. 

I just want to hear from others to see If they've had similar experiences and If so, if there is hope that things will improve if I continue to stay sober. I no longer continue on using it and want to make it years before I even think about picking it up again. "
1koaq6u,cannabiscultivation,worry,"This is my first grow ever.

I pruned the bottom leaves and baby sprouts yesterday but i havent done any major pruning as im not sure where to and dont want to cut off to much. I haven't done any topping because I am worried about space in my tent. (3x3x6) I am doing some tucking though. 

These girls are just over 4 weeks old. 

My main questions are when should I swap to flower?, I was thinkin another week or so. And without topping will I be okay with space? "
1krmkv0,microgrowery,worry,"I have no more space to raise my light. Definitely worried with the stretch. Lights only at 30%, a little leaf curling and light damage on 1 or two leaves nearest the light. Supercropping the biggest tops only made them angry. She's grown passed the light. What do I do? Any advice helps ✌🏽

P.S. These are all autoflowers"
1krscjz,leaves,"sleep,worry","m17 here been smoking daily for like a year, not smoked in ab two days, first day i didnt fall asleep till 5am, and last night i didnt sleep whatsoever, sleeps always been a problem since i was young so its nothing new, went thru psychosis last year and my mum is worried that the sleep deprivation is gonna mess w my head, any tips to combat it?"
1kt7gy4,leaves,dream,"I'm on day 15 and feeling awesome. I have quit in the past and remembered that the dreams were intense, and they are very intense again. For those of you who have been cannabis free for long enough that your dreams have begun to regulate, how long did it take?"
1ky440o,leaves,anxiety,"
I stopped smoking 10 days ago. I’d been a daily smoker for 5 years, and for the last 2 years, it was 1–2 joints every night. I really want to quit, and I know I can — but at the same time, smoking gave me chills, helped with my overthinking, and calmed my anxiety.

I like watching movies and listening to music after a long day, and having a joint during those moments used to feel good. I go to the gym 3–4 times a week, I run 1–2 times too, I have a solid job contract, I read before bed… I try to stay on track.

But honestly, I don’t feel like the pressure inside is going down, even with all that. I’m bored of my routine. I have to wait until September to go on vacation, to finally get some change.

And because of that, I feel like smoking again. I don’t want to fall back, but the temptation is real. I need help to stay focused and remind myself why I stopped in the first place."
1kz5j6y,CultoftheFranklin,"anxiety,nightmares,sleep","Helping someone out that has an issue with ptsd and specifically nightmares that are ruining sleep, but also hasn't had a good time anxiety-wise the times they've tried smoking in the past.   
I thought low-dose vaping  a good indica (flower or concentrate) and maybe combining it with some cbd bud or isolate for the anxiety would be good idea. Anyone able to recommend any vendors for either or other ideas? Thanks!

"
1l2by8x,entwives,sleep,"Heyo my first upload but I would have found this useful a few years ago so hopefully this helps some of you all trying to get into dry herb vaping! 

For those who want it written. 
I start my temps at 320°-330°F. Pack the bowl and light her up, wait 30s-1min once it gets up to the starting temp. Then take slow deep breaths. Long and slow are key here for pulling the Solo 2 well since it’s a ‘sipper not a ripper’. 
Every min or two I increase my temperature by 10° taking slow deep breaths for a total sesh time of 7-10mins. 
My max temp is 360°F and that stuff is cashed after, I just throw it out instead of saving it because the avb at that temp doesn’t make good edibles. I usually actually end my season on 350°F 
Remember to run a cleaning cycle and clean it out every once in a while! Q tip with rubbing alcohol to clean out the inner chamber then turn the solo up to max temp and leave it to run a full session! (10ish mins depending on ur settings)

The vapor produced will at first be lighter but just remember slow and long. Like the long part is just as important as the slow part, you have to draw it out!! At higher temps the vapor will be ‘thicker’ but eventually you will notice it tastes bad. You want at the end of the sesh for your bud to be an even brown and not burnt (there is a difference but it will take a time or two to learn) especially if you want to use this AVB to make edibles! 


I used to be a blunts only girl and it is a lot different smoking the Solo 2. I had a few months where I truly hated the Solo 2 before I worked out my personal user error and then another few months for my body to finally enjoy the high. Now I hate smoking blunts/ joints bc it just makes me feel gross (partner still loves it tho so everyone is different lol). I do recommend taking a week or so break from combustion because again, the vape is totally different. Also yall you can use other herbs like lavender which I lovvvvee using with weed to help the days I really can’t sleep. Anyways I hope everyone reading this has an amazing high! "
1m62qm,entwives,"headache,insomnia,pain,sleep","I made it til 1:45 and woke up to ridiculous pain, nausea, headache, joint pain and overall suckiness. I got out my anti nausea meds, percocet, and an ice bag for my head.  added that to a giant glass of water and my couch and here i am. After bombarding Facebook with all sorts of random crap, I tried reading. Then I was online window shopping. My nemesis candy crush saga is next.  I REALLY just want to sleep but fucking steroid insomnia is not helping. "
6ysgfw,leaves,"afraid,fear,headache,hurt,pain","Almost a month ago I smoked a bowl of marijuana with a friend. Since then, I've had miserable symptoms. I have constant severe brain fog, a persistent headache (the more I try and think the more it hurts), trouble forming words, bad memory, trouble invisioning/imagining things, pain behind my eyes, fever, fatigue, and diarrhea. The most concerning thing for me tho is the inability to think and constant empty mindedness. I don't feel like myself and also feel like it's changed my personality. I had a brain scan done the week all of this occurred but everything was normal. I read that marijuana can cause long term damage in teen years, Im 16, plz help me. I pride myself on my intelligence and am afraid I've ruined my brain. Is this normal? Does anyone else feel this way? If I did cause damage is it reversable? I rly need answers, I fear for the worst."
7wx4gw,vaporents,pain,"Hi Everyone,

Have gotten a lot of good advice on this forum, but finding the right vape for myself has been quite a pain.

I bought an iolite, but it's not been great.

I have done a lot of research, and have almost 100% decided on a arizer solo or air.

Having done all this research, and seen the sheer amount of people posting about what vape they should get, I thought putting all the current knowledge into a quiz might be a worthwhile idea.

I've seen the resources on this forum which are very good, but it's all a bit technical - this quiz would just ask questions about your lifestyle, how you want to use the vape, what your experience level is etc and then give you a 3 recommendations at the end.

TL:DR: if this post gets 50 upvotes, I will put the work into making a beta version of a 'What vape is right for you' quiz/self assessment for feedback from peeps here. If not, there's no interest, and I won't bother.
"
8ajnd3,cbdinfo,"dream,pain,worry","As I was getting ready to cook lunch for the day a thought popped into my head that I could use some CBD Isolate from Cali Born Dreams in my dish to get a different option than just taking CBD in a tincture format.


I took a few minutes to figure out the best method because I didn’t want to use my tinctures. I couldn’t find my CBD coconut oil from raised spirits and then I remember I had some CBD Isolate from Cali Born dreams.


The CBD Isolate I added it to my mashed potatoes that I was making with steak. I bought this 5.2 L air fryer from Amazon and I have cooked chicken and fish in it this past week. The flavors are so much better than cooking on a regular stove. It is also much healthier than cooking food in a lot of oil.


I seasoned my steak strips using Oregano and thyme that are grown in the backyard along with peppercorn, Himalayan pink salt, and my favorite Caribbean complete seasoning. It takes only 20 minutes to cook.


After boiling the potatoes, mashing them up and adding seasoning I sprinkled half of the CBD powder \(500mg\) all over the potatoes. I then mixed it up really well. As I am doing this on the fly I cannot give exact amounts per serving. I estimated I was received around 40\-50 mg per serving.


The effects took a little over 2 hours and I felt the pain in my neck and shoulder slowly went away. Being able to feel relief from the pains gave me joy that the CBD Isolate was working. I was worried at first that it was not going to work. The CBD lasted in my system for more than 8 hours.


Overall I like the flexibility of using the CBD Isolate powder, however, I wish the price was cheaper. The cost of $60 per gram is much higher than others.


[Read more](https://www.cbdreviews.net/cooking-with-cali-born-dreams-cbd-isolate/). "
9vi3ax,CBD,"anxiety,nervous,overwhelmed,paranoia","I can only describe what I felt as the feeling of a hundred voices in your head (not literally) that wasnt necessarily stemmed from anxiety. It was just very easy to get distracted and I couldnt work on something for more than ten minutes. Never on time for anything, impulsive, nervous etc etc

Sounds like ADHD right? So I basically self diagnosed myself, found a psych, and went on Vyvanse. But heres the issue

The hundred voices were still there. But now I could (kinda) block em out. So all Vyvanse allowed me to do was focus on what was in front of me for a little longer than usual before being overwhelmed 

It really felt like I had no identity. Like my whole persona was just comprised of these fractal thoughts. 

I started smoking weed a few years ago. It made me think much better when I set the PAX to low temperature and took only a few hits. But it was a fine line between confidence and extra paranoia

Kratom helped. It made me confident. Good fix, but had its drawbacks of course. 

And I started vaping CBD. It actually took a few days to take effect contrary to what I read about vaping. 

But now I have one, singular, clear, and commanding, voice. Never felt this confident before. "
a40mi7,cbdinfo,sleep,"<!-- SC_OFF --><div class=""md""><p>I tried CBD oil at various dosages and my sleeping got worse.   My goal was to get it better.   CBD  was like a stimulant for me, but didn&#39;t make me feel weird.    I guess I am one of the odd ones.   It didn&#39;t work.  fwiw - brand PureKana </p>
</div><!-- SC_ON -->"
