id,subreddit,keyword,text
ljdd572,CBD,anxiety,No cbd oil is supposed to calm anxiety. I take crystalweed CBD oil and it works
ljvt1jd,trees,worry,"Soak up with paper towl, and squeeze it through a filter. Boil afterwards if you're worried about germs"
ljvxvgm,leaves,"pain,scared","Unless you have reason to think you have lung damage (bad cough, chest pain—in which case, doctor asap), you’re probably fine. The damage smoking does is largely cumulative and mostly repairable. While you smoke you put yourself at higher risk of certain issues, but you’re young and your body still has amazing ability to heal! You sound scared, and that’s not a place to make any decisions from. Take a deep breath, you’re not in immediate danger. It’s all about long term odds and deciding to start skewing them in your favor BEFORE you have any issues is the best thing you could do for yourself."
lk14gq9,trees,insomnia,Had insomnia as a teenager. Buddy said it would help and it did
lk1v8a6,trees,"anxiety,stress","I have bouts of bad anxiety that send my mind racing for days on end. I'd get something stuck in my head, like a problem or plans for something coming up, and wouldn't be able to get my mind off of it. I'd go crazy going over things again and again and again, to the point where I'd wake up in the middle of the night with my brain screaming about it. That would up my stress levels, and keep me in a dark loop.

I tried anti-anxiety meds and they helped helped deal with the emotional end, but only helped a bit with my stress and were never able to calm my mind. I'd feel like a zombie. I tried therapy and got some coping mechanisms, and they helped for day to day anxiety, but none of them helped when I had a bad attack.

A friend of one of my brothers would stop by once and a while, and he'd usually bring a couple joints or a pen/vape, and THAT did wonders! This year was on track to be one of the worst I've had with my anxiety, and I finally got my medical card. This is the first year in what feels like forever that I haven't had a full breakdown from my anxiety, and I feel happy, and not like a robot."
lkb0kx2,weed,worry,"
*Thanks for posting, u/No-Dot-3603.*

- Make sure you follow **[r/weed rules.](https://www.reddit.com/r/weed/wiki/rules)**

- Do not engage with ""vendors"" in your DMs and report those accounts in your chat and messages and also [here](https://www.reddit.com/report)

- Attempting to source drugs is against **SITE-WIDE** terms of services. an immediate, permanent ban will be imposed. 

- Don't resort to insulting other users, stirring up drama, or worrying about what's on someone's profile. Just report any posts/comments that you see breaks the rules.

- **[Info about scammers](https://www.reddit.com/r/weed/wiki/information/scammers)** 

- [Join our Discord](https://discord.gg/rweed)


*I am a bot, and this action was performed automatically. Please [contact the moderators of this subreddit](/message/compose/?to=/r/weed) if you have any questions or concerns.*"
lkddwi5,Marijuana,stress,The dispensary is so much nicer an experience than weirdos in the neighborhood selling the chronic or worse stress.
lmfe1sw,leaves,panic,Panic attack?
lnhp8gj,treedibles,hurt,It ain’t going to hurt anything
lok9z2q,Marijuana,afraid,">and the science backs it up.

No it does not. Much of the anti-vape science is based on assumptions from medical research done for cigarettes and vaping is simply not the same thing as smoking tobacco or marijuana. I personally think smoking out of a cart sucks but I defend the use of the technology because it's wildly successful at getting people to stop smoking tobacco. It puts me in a situation where I suggest that they not choose a vape but it is absolutely acceptable if it's that or tobacco. 

My only problem here is that science does not back up any direct correlations between vaping and long term medical issues. There are lots of things you can go get and post for me but nothing about anti-vaping medical research is anything but a supposition or partially linked in a co-morbidity so don't bring my anything that doesn't say this negative health result is the direct effect of vaping. Anything other than that is just a guess and that is causing people who would otherwise use vaping to stop smoking to be afraid that vaping is even more dangerous to you than smoking tobacco. Anti-vapers need to tone it down."
lpydmkp,weed,worry,"
*Thanks for posting, u/icewaterdimension.*

- Make sure you follow **[r/weed rules.](https://www.reddit.com/r/weed/wiki/rules)**

- Do not engage with ""vendors"" in your DMs and report those accounts in your chat and messages and also [here](https://www.reddit.com/report)

- Attempting to source drugs is against **SITE-WIDE** terms of services. an immediate, permanent ban will be imposed. 

- Don't resort to insulting other users, stirring up drama, or worrying about what's on someone's profile. Just report any posts/comments that you see breaks the rules.

- **[Info about scammers](https://www.reddit.com/r/weed/wiki/information/scammers)** 

- [Join our Discord](https://discord.gg/rweed)


*I am a bot, and this action was performed automatically. Please [contact the moderators of this subreddit](/message/compose/?to=/r/weed) if you have any questions or concerns.*"
lrkpyj0,delta8,sleep,If it's also high in CBN you'll just get more sleepy as CBN will make you more tired than any other cannabinoid.
lt26glm,CultoftheFranklin,worry,Yep what they're telling u is true it's all based on the 2018 farm bill hole -loop 😅 Thc-a is cannabis sativa L it is weed literally no difference. Pick a good vendor and begin your journey of having the mailman hand u qps legally. It's for real lol. Treat it exactly as weed because it is. Just keep it at home and you have nothing to worry about. 🫡
ltamacg,Petioles,sleep,"I’ll start by saying you should be commended for having the awareness and desire for self reflection at your age; I know I didn’t in my early 20s. I’m 42 now, have been smoking daily for about 25 years, and my usage ramped up significantly in 2015 after moving to a recreationally legal state. Other than that, what you’re describing regarding your conflicting feelings sounds very similar to my experience. 

I’m currently on day 23 of a tolerance break, which is my longest cessation since 2018, and that was solely the result of a 3 week trip abroad when I didn’t have access to it. My present intention is to clear my system out completely, which I expect around day 40 or so. I tested positive yesterday, so still working it out. 

I’m partially doing this as an experiment to determine if I have whatever enzyme condition that makes one immune to edibles as they’ve never worked for me, but my tolerance has been so high for years now that it’s possible I just wasn’t able to tell. E.g. I have friends who would get high from a 10g gummy, while I would take 100g of the same product and not feel it. It goes without saying that having that high of a tolerance is very, very expensive; I was spending $400-500/month at the dispensary. 

Either way, I do plan on smoking flower again as it’s an enjoyable, relaxing experience that I miss, and I’m well into a successful career so I tell myself I “deserve it”, however deluded that may sound.  

After the first week, I found that getting through the day without a bowl was easy enough, but the evenings are challenging, and on this current break I find myself having a drink or two while I typically do not drink. I’ve found it helps me sleep, but I’d rather smoke than drink for health reasons. 

Also worth noting that I have a newborn, so my typical schedule has been Interrupted, and when my wife takes her to bed a few hours before me I find myself wanting to enjoy the little sliver of “me time”. Predictably this makes me crave a bowl or two.

When I start again I plan to take a “just weekends” approach but I know from experience that this will be a challenge as I’ve tried before to smoke only in the evenings, and within a week or two have always ended up back at 2-3 times throughout the days, usually starting just after my morning coffee.

Anyway, I’d meant this to be a concise reply but I’ve clearly used it as an outlet to journal my own thoughts and struggles, so I hope it’s been insightful and/or helpful for you in some way. But truly, the fact that you’re aware of the potential issue suggests you’re on the right path. “You got this” feels a bit cliche in this sub, so I’ll just say good luck to you. 

TL;DR - You’re definitely not alone."
lud6qg8,microgrowery,hurt,"I counted over 7 seeds.  It is what it is.  If they are done pluck em, if they need more time, go for it.  The damage is done and it can't hurt to keep them going till done, though they look pretty done from here."
luui0np,leaves,"anxiety,paranoia,stress","i am the same way. stopped for months was super healthy and happy. started working my first corporate job and smoked to cope with stress. gained 20lb back and stopped doing my active hobbies. during my commute to work i get some time to decompress and i can feel something is wrong, i know using weed is causing or exacerbating paranoia, anxiety and depression. 

yet i can’t stop smoking, even though i want to. the brain is a weird thing. 

i guess we can be grateful it isn’t a harder drug but it’s still an issue."
lv08rj4,leaves,"insomnia,sleep",Hey I’m struggling so much with quitting - I get the worst insomnia ever and I literally can’t function. Each time I quit I relapse after about 3 weeks of no sleep cause I just can’t deal with it anymore. Please can anyone give me some advice? Thank you
lvdrf5d,Petioles,anxious,Keep us updated! I’m in a similar situation. I’m trying to find ways to make it easier on myself. Gonna make a list of things to do when I wanna smoke. When I do smoke I wanna log how it makes me feel because recently when I do smoke I feel regretful and anxious. But as soon as it gets late in the night I wanna smoke no matter how I know it’s gonna make me feel. Do you have a plan for coping with not smoking? Looking for advice too lol
lw5g02a,Petioles,dream,"I take nightmare medication, so that might help me with the dreams. I'm two weeks into the break and feel fine rn but I find that I miss it more as time goes on... maybe because at the beginning it's not fully out of my system"
lxghstp,microgrowery,stress,"Super cool idea - this type of stress may legit increase 'noid content or THC marginally too, per some of the Bugbee stuff I read a while ago!"
lxhtd88,microgrowery,nightmares,"I've never had pm or these bastards 😫 until now. I just started this hobby in April. Each run, I've had nightmares from the stories I've read. Well this run, it became a reality 😭. But I know now, to go in my lung room butt ass naked or in fresh clothes from out of the dryer because this morning I was about to throw all this grow ish away, I was crushed. I'll be praying you never 😔 experience this."
lxhtd88,microgrowery,nightmares,"I've never had pm or these bastards 😫 until now. I just started this hobby in April. Each run, I've had nightmares from the stories I've read. Well this run, it became a reality 😭. But I know now, to go in my lung room butt ass naked or in fresh clothes from out of the dryer because this morning I was about to throw all this grow ish away, I was crushed. I'll be praying you never 😔 experience this."
lyj238p,microgrowery,anxiety,The anxiety.
lzlck3z,weed,worry,"Bra we're sharing joints not fucking, no need to worry about STDs"
m0l8vxw,leaves,"dream,overwhelmed","Same here, day 5 is about to be complete, I’m overwhelmed, especially cuz of the really disturbing dreams"
m23nysp,trees,stress,Any combination of 2 of those seems like a decent way to keep stress at bay.
m2pskur,cannabiscultivation,spiraling,"Gently dig her out and make sure to not disturb roots, they are going to be super fragile. Then transplant to a beer cup by putting in a couple of inches of soil. Then start burying the roots and stalk in a circular manner, spiraling up toward the top of the cup. You will need to add soil as you go. finish with the leaf just above the soil. If you do this correctly you won't kink the stem and the plant can then be placed much closer to the appropriate intensity of light. I'd throw in some root bacteria just to get the stem to start producing roots. A second pair of hands would be helpful."
m3x0236,treedibles,worry,Double boiler will make sure you only go up to the temp of boiling water. Saves a lot of worry
m5twodf,saplings,"hurt,worry",I just wouldn’t be worried unless it hurts cause that could be like seizures and shit.
mbfq0hi,leaves,sleep,"I cant overstate how much reading before bed has changed my sleep, it really did wonders for me."
mccuhuz,CBD,anxiety,"I've been using CBD for a while now, so I totally get your frustration. I tried capsules before, but they didn't really do much for me—I felt like I was just waiting for something to happen, and it never did. When I switched to neu𝓇oga.n’s full-spectrum oil, I actually noticed a difference. Taking it sublingually helped it absorb faster, and I started spreading my doses throughout the day instead of taking one big dose. This method gave me much more consistent relief for my anxiety and overall well-being. It took some trial and error, but once I found the right balance, it was a real game-changer. Everyone reacts differently, so don’t get discouraged—trying out different forms, dosages, and timing can really make a difference. I hope you find what works best for you!"
mcvuily,saplings,"insomnia,pain,sleep",Yeah same. Started my consumption with edibles around 5 or 6 years ago or so for pain that painkillers didn't help. Learned real quick it helped me with my insomnia. It's super nice to not take a few hours to fall asleep and not wake up a couple dozen times. It's genuinely a great feeling to actually sleep.
mk7dgvv,leaves,"panic,slept","The day before Yesterday was my worst day (3), i hadnt slept thr night before and only 3 hours the night before that. I was super nauseas and later that night i ended up having a panic attack (first of my life) and had one again last night. Today im feeling way better, still doing the brats diet and being careful about nausea. It takes time"
mn92nsg,Marijuana,headache,All it did was give me a headache for a little bit. I’ve got a high tolerance and it didn’t do much.
mpwtxx4,microgrowery,pain,"That seems like a pain in the ass. To answer your question, whenever the heck you want. You need \~12 hours of uninterrupted darkness to begin flower.

Alternate suggestion:

Bend the plant over, tie it down or supercrop it, or just top it and cut it in half. Make the plant more squat, more bushy. Then just leave it alone, maybe put it where it can get more light, and let it flower out naturally when its bigger and summer hours start to decrease as we approach fall."
mq0jsb4,entwives,dream,"Totally jelly of your spot! One of these days, I'll build my dream spot - a screened in gazebo in my pasture."
mran07r,weed,worry,Trial and error big dog. Unless you’re buying from someone extremely sketchy I wouldn’t worry about anything being laced. Worse thing you might get is some low grade flower sprayed with delta8 or something.
mrk3p2w,trees,worry,It's worrying to see the votes on this.
mrx3fv6,leaves,"dream,pain,sleep","I quit on the 21st of April, in my third week and the circles are still evident af. Sleep’s gotten much better i can finally dream!!! The healing part is still a pain i hit my shin somewhere more than a week ago and it still hasn’t recovered. However, I definitely look a lot better than when i was on weed. Skin’s so much more vibrant and the color has come back idk if that makes sense lol."
ms9s9lq,treedibles,nervous,"Huh. Mine is more breaking out in hives from exposure. Being submerged in cold water or ending up in a shower that's cold starts making it hard for me to breathe though. I wouldn't say my throat is closing or airway is seizing though. More of a central nervous response, it feels like."
msdq33y,weed,worry,"
*Thanks for posting, u/SpiffyBlizzard.*

- Make sure you follow **[r/weed rules.](https://www.reddit.com/r/weed/wiki/rules)**

- Do not engage with ""vendors"" in your DMs and report those accounts in your chat and messages and also [here](https://www.reddit.com/report)

- Attempting to source drugs is against **SITE-WIDE** terms of services. an immediate, permanent ban will be imposed. 

- Don't resort to insulting other users, stirring up drama, or worrying about what's on someone's profile. Just report any posts/comments that you see breaks the rules.

- **[Info about scammers](https://www.reddit.com/r/weed/wiki/information/scammers)** 

- [Join our Discord](https://discord.gg/rweed)


*I am a bot, and this action was performed automatically. Please [contact the moderators of this subreddit](/message/compose/?to=/r/weed) if you have any questions or concerns.*"
mswuoei,leaves,panic,I would take bong rips all day before work and after work until it caused me to have a panic attack. It meant to happen so i would.finally quit
mtqhyjh,cannabis,hurt,Ya Patrick and paxton like getting behind the wheel I'm sure after most likely having a liquid lunch but drinking and driving is ok I guess I hate alcohol it changes people makes some people down right mean and to obnoxious to be around and believe me I've been around a pardon my pun but I've been around a lot of drinks in my life time including some relatives alcohol is disgusting marijuana thc-a or CBD never hurt anyone but alcohol has it kills one way or the other I can't stand Patrick as far as I'm concerned he can join Trump and musk they all three can go to Africa and live with musk and swing from the trees with the rest of the Hippocrates because that's what runs this state and this country is lying Hippocrates.
mtvyl1l,CultoftheFranklin,dream,After a second run through it's okay nothing special it's mid compared to the Georgia pie and blue dream budget. I was fresh off work but now the second run yeah I should have chose a different one lol.
mu2k3q6,leaves,anxiety,I am 1 month and a few days sober. My anxiety cleared up around the 2 week mark and by the third week I was feeling alot better than i was. I feel better than I have in years. It is worth it.
mvk9xw2,weed,anxiety,"i used smoke a lot but having some strong edibles is honestly more enjoyable because it completely alleviates my anxiety, which doesnt happen at all if i would smoke or vape while my tolerance is high."
mvrsinx,trees,"hurt,pain","I have chronic pain (mostly neck and back, knees hurt too) and I want to get some topical that actually works.  There is this brand that combines other stuff with THC and it looks all Hawaiian that's been recommended to me but now I can't remember. Anyone have any recommendations on topicals that work for pain."
mvu5g8h,weed,worry,"
*Thanks for posting, u/isthisnotaname.*

- Make sure you follow **[r/weed rules.](https://www.reddit.com/r/weed/wiki/rules)**

- Do not engage with ""vendors"" in your DMs and report those accounts in your chat and messages and also [here](https://www.reddit.com/report)

- Attempting to source drugs is against **SITE-WIDE** terms of services. an immediate, permanent ban will be imposed. 

- Don't resort to insulting other users, stirring up drama, or worrying about what's on someone's profile. Just report any posts/comments that you see breaks the rules.

- **[Info about scammers](https://www.reddit.com/r/weed/wiki/information/scammers)** 

- [Join our Discord](https://discord.gg/rweed)


*I am a bot, and this action was performed automatically. Please [contact the moderators of this subreddit](/message/compose/?to=/r/weed) if you have any questions or concerns.*"
mw5xxl8,leaves,"anxiety,stress","Yep. Cant relate more, took a Sr. Leadership role and fuck me the anxiety was mind boggling. Today is day 5 no smoking. The same shit that would stress me out to the point of no return, now just has me stressed a little. 

Insane what this drug does to the brain."
mw6dwfd,weed,worry,"
*Thanks for posting, u/_Envory.*

- Make sure you follow **[r/weed rules.](https://www.reddit.com/r/weed/wiki/rules)**

- Do not engage with ""vendors"" in your DMs and report those accounts in your chat and messages and also [here](https://www.reddit.com/report)

- Attempting to source drugs is against **SITE-WIDE** terms of services. an immediate, permanent ban will be imposed. 

- Don't resort to insulting other users, stirring up drama, or worrying about what's on someone's profile. Just report any posts/comments that you see breaks the rules.

- **[Info about scammers](https://www.reddit.com/r/weed/wiki/information/scammers)** 

- [Join our Discord](https://discord.gg/rweed)


*I am a bot, and this action was performed automatically. Please [contact the moderators of this subreddit](/message/compose/?to=/r/weed) if you have any questions or concerns.*"
mw73i5r,weed,worry,"
*Thanks for posting, u/pugman3645.*

- Make sure you follow **[r/weed rules.](https://www.reddit.com/r/weed/wiki/rules)**

- Do not engage with ""vendors"" in your DMs and report those accounts in your chat and messages and also [here](https://www.reddit.com/report)

- Attempting to source drugs is against **SITE-WIDE** terms of services. an immediate, permanent ban will be imposed. 

- Don't resort to insulting other users, stirring up drama, or worrying about what's on someone's profile. Just report any posts/comments that you see breaks the rules.

- **[Info about scammers](https://www.reddit.com/r/weed/wiki/information/scammers)** 

- [Join our Discord](https://discord.gg/rweed)


*I am a bot, and this action was performed automatically. Please [contact the moderators of this subreddit](/message/compose/?to=/r/weed) if you have any questions or concerns.*"
