id,subreddit,keyword,text
fx4kxxa,weed,slept,"Dude I deel that on another level, my first dab was at a family campout, my cousin happened to have a rig and dab with him and dude.... I slept for like 5 hours I stg"
fzyq2ar,cannabiscultivation,stress,">These were 1gal going in and low water levels at this garden. We have a new well in the works. Girls are stressed here. Definitely not ideal.

If you're concerned about water, smart pots are a bad choice. Might want to investigate a different material to build your beds/holes out of that conserves water better"
g3fe3qs,Dabs,nervous,"before i sat down, I told the barber that I had a bit of a cough that was  from smoking, then I broke out in a bit of a sweat due to  coming in from 115 degree heat and a long walk.  She wouldn't even take a tip she got  so nervous.   I'm so happy I'm retired and don't have to deal with all this stuff."
g56qo5c,cannabis,"pain,stress,suffering","Currently serving myself and I'm looking to get out after my contract ends. I have plans to pursue a cannabis focused career and, since serving, I've developed a desire to help change the military minds that are against marijuana use, especially for Veterans.

While I don't believe it will end all suffering, nor do I believe it to be free of issues, I do belive that an alternative to Alcohol and Tabbaco will give service members an opportunity to balance stress relieving substances and give them a secondary choice for pain relief, the other being opioids."
gew47z8,delta8,pain,"Wow I’m so sorry about your diagnosis :( I was wracked with doubt as well- especially being a chronic illness patient you know when something seems too good to be true, it usually is. But I have had such a positive experience both in pain relief and nausea relief! It’s like finally, something that helped me get through this physically and mentally!  I hope you find similar relief, keep me updated on your journey :) I’m always happy to share info, it was well worth it if helped even one person!!! There aren’t many people in these situations so visibility is always my main goal! Wishing you nothing but the best and I hope you can benefit from adding this beautiful little cannabinoid to your regimen :)"
ggk6bi4,hempflowers,anxiety,"Yes there's thca, Delta 9, Delta 8, Delta 10 all are THC. Delta 8 if properly sourced is derived directly from hemp and therefore legal federally because it contains less than 0.03% Delta 9 THC. When purchasing CBD or Delta 8 you should always have access to a certificate of analysis identifying what is in the product and at what percentages. Delta 8 is more of a physical high and less of a mental high but also comes with very little to no anxiety which is often produced with Delta 9 thc. Delta aid is quickly becoming people's favorite form of THC it's a great way to get off of using so much Delta 9 or even kratom, but a head shop won't tell you that because they make so much money off of kratom. For me personally I like CBD and don't care for Delta 8. So Delta 8 THC is an isomer derived from hemp.on our packages we don't even identify it as a THC but a Delta 8 hemp derivative as suggested by an attorney."
gq3asts,trees,"afraid,anxiety,anxious,overwhelmed,panic","Tbh I can get that, it's not as ridiculous as it sounds. But I have an anxiety disorder so it's probably mostly that.

It's just that coke mainly makes you feel awake, motivated and confident and ketamine, while very intense, is an anxiolytic and sedating so usually you won't really get freaked out when it's too much for you.

Weed on the other hand is much closer to psychedelics than people imagine, it's just way easier to take too much, get anxious and overwhelmed and since it amplifies your feelings just like a psychedelic you can easily end up in a cycle where your fears get worse and worse and you're having a panic attack or getting really paranoid.     
But tbh I wouldn't say I'm ""afraid"" of it, I'm just more careful to only consume as much as I can handle now.      
I guess you could call that being a bit afraid ¯\\\_(ツ)\_/¯

But weirdly weed helped my anxiety lot when I was younger and now it's often the opposite. Probably because my anxiety disorder got a lot worse."
gsnmumn,leaves,anxiety,"Wow thanks for sharing your story.  Day 4 is always tough emotionally, but it sounds like you especially have been thru a lot lately. I'm pretty sure everyone cries around day 4/5. So glad you are OK and taking care of yourself.  The real,  raw you will take some time,  but know that the struggles are worth the end result of having a clear mind and dealing with your problems head on and being a more present parent.  My anxiety has dropped considerably since I stopped and I too would smoke before literally anything I had planned for the day aside from work. Stay strong and welcome to /leaves ✌💚"
gvt6kge,Dabs,sleep,I’ve been on a military base visiting family and haven’t been able to smoke at all. 5hours from now I’m ripping the fattest dab after sleeping in this god damn airport
gxijxeu,cannabiscultivation,"anxiety,paranoia",It's a pure anxiety/paranoia sativa high for those with no tolerance. Not the highest THC in the world but it'll getcha
gxktuvz,MMJ,"anxiety,pain","I agree. I smoke purely CBD during the day and it works great for me for anxiety, depression and a bit of pain relief. It just generally puts me in a good mood without having that high feeling so I can still function, drive, have a conversation, etc.

At night I smoke a bit of Indica but not too much because I find the higher feeling I get them more *anxiety inducing* it is.

I may start trying a 1:1 ratio in the early evenings so I can start winding down earlier.

If you've never used any thc product before it's going to take some trial and error. I suggest some research on Leafly, then swing by a dispo that has what you're looking for and buy a few small amounts until you figure out what works for you. There will be times you smoke too much, or a strain doesn't work for you and your anxiety goes up... Just remember it's ok and make note of how much you smoked that time... Then cut it back the next time until you get dialed in. Everyone is different."
h1s5v01,microgrowery,sleep,Is that sleep apnea tubing?
h36hoh7,leaves,sleep,"
>The reality is my life is eons better, when I do not smoke. I know this, I can acknowledge it, and yet I am still susceptible to weed usage. That is text-book addiction right there.

I've hated having to accept this. For so long I would try to get by while smoking everyday after work. 

Going to work the next morning in a haze and trying to ineffectively understand technical jargon my engineers were explaining to me made me finally put the bong down. Well, that and the solid two weeks of binging on takeout because I was too lazy to cook lunches and dinners. 

It's been about a week since then and I'm feeling much better. The first couple days were absolutely fucking terrible though because I was experiencing cravings, poor sleep, and the ""what now"" feelings. 

I don't think I'll ever be able to truly give it up but I have picked up that I spiral out of control once I have my own supply of bud I can always rely upon. When I'm with a friend for a sesh I feel like it's a one-time thing. Idk, I'm still trying to work this thing out with myself."
h485lu4,MMJ,"anxiety,anxious,fear","Forgive me if any of this is confusing, or abrasive, I’m terrible with words but I’ll gladly further clarify.      

Different family lines of cannabis produce entirely different compounds, and some can help while others will exacerbate your symptoms. There are over 100 different cannabinoids and dozens of chemicals produced by cannabis that affect its effect.       

If you decide to smoke long-term, it is ***inevitable*** that you’ll eventually run into cannabis that makes you more anxious, or paranoid, or what have you.       

Anxiety evolved as a way for us to recognize real world threats that we don’t believe we are capable of surpassing. Some of us just have an oversized reaction, but the basis of that fear might be more valid than we care to admit. The best way to deal with it is bettering ourselves in the things that pertain to our anxiety. If your ptsd is violence related, consider martial arts and a personal trainer."
h6f95zv,cbg,"anxiety,freaking out,pain,sleep",I have bad issues with freaking out from smoking thc. I’ve learned that if you take CBD with the thc it makes it work differently and helps calm you down I smoke a strain called harlequin that has like 6 percent thc and the high is very enjoyable. I just smoked CBG for the first time a few minutes ago and I’m starting to feel sleepy . But I also took pain meds for my tonsillectomy so that might be the reason. I feel fine no anxiety. I say go for it!
h9xkcst,treedibles,pain,"I have chronic pain due to fibromyalgia, autoimmune disease and also have allergies, and need the easiest way possible to make edibles. Making my own edibles wipes me out so if I can make them with less effort I won’t be stuck in bed for a week after. I can’t afford to buy oil from the dispensary because it’s so expensive. I could really use this and it would make my life so much easier."
hb397j7,delta8,"anxiety,stress","I definitely smoke from sun up to sun down most days. Especially work days. Helps with my extreme stress levels and usually my anxiety.

&#x200B;

Side note (and I hope this allowed but if not, someone let me know and I'll delete) if you're in the US, look into dental tourism. My teeth were fucked until April of this year and I went to Mexico and got everything I needed done for $900 and honestly, the quality is better than the work I've had at home. I went to a border town called Nuevo Progreso and a dentist called Progreso Smile Dental Center, which I highly recommend. Depending on where you're located, it might be a lot easier for you to do that. I went there from WV and the whole trip was less than one root canal here in my city."
hbubloo,Petioles,nervous,"Hobbies hobbies hobbies.  If I’m not smoking I’m building gunpla I’m hiking, fishing, skateboarding, Airsoft/paintballing.  Now trying to not smoke before these activities is key because smoking makes me nervous that I will mess something up.  Minus fishing cause anyone can smoke doing that.  As for restlessness and agitation I cannot help you there because I use cannabis for that exact reason and a few others."
hdlcwhm,microgrowery,pain,"Awesome!

I got a lot out of a video from Kyle Kushman, doing HST and pruning, in case no one’s recommended it yet. He has a nice way about him. 

Haha larf is a pain come trim time but hey, it works! Honestly, even when a grow doesn’t go well, I’m blown away that I managed to produce anything so I’m sure your friend is ecstatic as well!"
hl1d3mh,Dabs,scared,Doing drugs is dangerous. There are inherent risks. That’s the nature of the beast. Your friends shouldn’t drug you because that’s horrible but in this hypothetical aren’t you asking someone to drug you? So there would be risks like let’s say getting a heavier dose than you’d like or expect. Everyone gets a laugh out of someone else’s slight misfortune because it’s just funny. It’s so disappointing seeing everyone try to make everything so PC and pathetic. If you want to never get too high or never have someone screw you over on your drugs then don’t do drugs!! It’s your choice and if you’re scared of dabs just stay home and don’t do drugs it’s really that fucking easy.
hnmy67h,cannabis,"nap,sleep","Smoke all day every day. I sleep 8 hours with four hours of short indica naps during the day.

IMO, not enough indica affects our sleep.

Sativa and sleep rarely mix well."
ht48nnk,CBD,anxiety,"Yes, I’m sober 9 years. I deal with depression and anxiety and continue to seek the best cocktail to combat it. I simply don’t want to be taking something that would alter my mind(getting high), body and soul"
hzunzb0,eldertrees,"anxiety,paranoia",“The weirds” is a great way to describe it. I also have pretty bad anxiety normally but I’ve felt like I don’t feel entirely comfortable where I’m living because I’m generally alone which adds to the paranoia. It will get better and then worse again. I appreciate this answer because it kind of confirms what I thought already! Thank you!
i1sqsji,MMJ,migraine,"Try Mag Landrace (Persian), Mazar Kush for migraines, and G13."
i7gro9o,leaves,pain,"Welcome to the family. I recommend you get involved in a local 12 step program, make some friends, work the steps, and never look back. Sorry you’re in pain, but all can be fixed. Much love."
ij9pv04,Petioles,anxiety,"I also have ADD and anxiety. Bud has had a huge beneficial impact on my anxiety, as well as helping me focus.
Have you considered trying any if the non-stimulant ADD meds?"
iua7o7z,hempflowers,hurt,i have a friend who’s young kid has ocd and they gave him cbd for a period of time and they think it might have helped or at least not hurt. just a small 2nd hand anecdote that it is something parents try and appears generally in the realm of safe and normal
iutm25j,weed,dream,"You are absolutely not in danger brother, very very safe. You’re just having a high that I could only dream of"
j6c0ig5,Waxpen,"shortness of breath,sleep","It goes from coughing fits to phlegm in your throat to wheezing at night when you're trying to sleep, to having shortness of breath!! I try to stay away from dabbing bho extracted concentrates, I can vape it in a cart sparingly but if I get shortness of breath, I go to my local CVS or Walgreens. Pick up a Primatine Mist Inhaler for $30, 1 or 2 puffs and my lungs open up! It has something to do with how hot you dab and what you're dabbing. Usually when I dab rosin, live rosin etc I don't feel like my lungs were coated with concentrate, I breathe normally soon after taking the delicious hit."
j87blmr,Petioles,"dream,melatonin,sleep",I get crazier dreams on melatonin than just sleeping. It all kicks off after a week of sobriety for me
j8f727x,leaves,sleep,"nod... 3 day's clean after a 10 day taper where I smoked once a day..  


Withdrawals are still real, but more manageable than times in the past when I just went cold turkey.  For instance I haven't had cold sweats yet and my appetite, while reduced, isn't to the point of not eating like times past.

Sleep is garbage, but I know in time it will improve."
j9d7p7h,Waxpen,dream,begging you to try a yokan. absolute tanks that work really well. i’ve had a magneto for 2-3 years and it still works like a dream
jaog22c,Marijuana,"anxiety,pain",I think about that as well. I have crippling anxiety and it’s does have effect on my pain.
jcvofrc,CultoftheFranklin,fear,keep spreading the baseless fear mongerering ..leaves more for us
jhxnop6,trees,worry,"Under an eighth and a scale they generally don’t care, if you’re worried about it leave your scale at home and weigh it when you get back"
jlqskkd,Marijuana,worry,"Well don't worry cuz he's not in favor of legalization, which the article correctly points out.  It's good information to know, regardless of what some of his other positions are."
jpw5que,leaves,"hurt,sleep","I quit for 6 months last year.
Had a BBQ, “couple of tokes won’t hurt”, I said..

Started off another (way worse, smoking 7am, then after work til I sleep) for a whole 6 months before I decided to quit again.

I’m 4 days in now. Fuck me.


All this is to say - be careful. Some of us go a really long time and still relapse. Stay strong."
jrxzzzu,weed,sleep,"The way I see it. I get high from both , but one makes me think a lot wich is a problem when trying to sleep and the other helps me sleep."
jx2j7bn,CultoftheFranklin,pain,"VG is good. I’m working through a zip they had for $75. People here talked smack, but it’s whatever. I’m appreciative, and it does what I need for my pain."
jyqsdeu,CBD,"anxiety,sleep","I'm 100% sure it wasnt placebo. I felt really different and my anxiety has gonne. Ive tryed tones of sleeping medicines I have never felt that way! But didnt last, unfortunatelly"
k2ijnd5,eldertrees,sleep,Sleep 10-11h after smoking hash daily🙈
kgdb4rn,leaves,stress,"Similar for me as well.  Started smoking recreationally in like 2018.  Then once the pandemic hit, I started as a way to combat stress. It’s gotten progressively worse.  I’d smoke two days in a row, then take two off.  Then two days became 4, then a week.  Weeks eventually turned into whole months.  There were periods where I’d quit.  Longest was from May to Nov 2022.  But I’d always start again bc I’d tell myself “Just once to mellow out”.    

But I’m done for good now.  Upon some deep self reflection, I realized that the day after smoking I was very withdrawn.  I wanted to be left alone.  I wasn’t  very fun/imaginative. Essentially I quit for my children.  I wondered how many moments I have no memory of bc I was high, or how many times they asked me to play and  said “maybe later”.  I realized there is a finite number of times they will WANT to play with me.  I don’t want to waste/take that for granted.  I want to be more emotionally available, and vibrant, and fun.  So, I am now finishing up Day 2 with no weed."
ksud5kq,cannabiscultivation,"dream,nervous,paranoia","Todays taste differnt, cakey, candy flavour etc, but the highs back them were electric, you could feel it in  your body, literally cursing through your viens, total energy hit. Paranoia was more common then though as the highs were HIGH, dreamy, almost mystical, trippy and had you nervous sometimes, you had to respect that bud. Weed now is great, looks fantastic, smells awesome but the high is too samey, to much cross breeding IMO. I crave 80s weed, maybe even 70s pure Sativa and Indica, lets get back to growing Landraces and getting that natural high back. Remember when weed didnt have silly names and it was named after the village or area it was from. More of that please. Pheno hunt landraces but dont cross em. Sure it could be nostalgia and rose tinted glasses on my part but I dont think it is.
I can dream."
l26e5x4,entwives,fear,"I have a very similar story to yours, I’m glad we were able to overcome the stigma (and in my case fear!) of trying cannabis. It helps me tremendously and I’m glad you were able to find something that helps you as well!"
l3l267i,microgrowery,hurt,Spiders aren’t going to hurt you plants.
l3zj50j,CBD,"anxiety,pain,stress","Get some CBD flower. Mix 1:1 with your regular.  I still get the  feeling of sativa's energy without anxiety and psychosis. Indica + CBD for that super chill, pain relief and stress."
l423cvw,weed,fear,"Its when manufacturers start adding fillers and additives in order to boost sales which will end up harming people and creating a new era of fear from marijuana. Why cant we just stick to natural, good smoke?"
l463omg,trees,anxiety,"Cannabis does have specific health benefits for me, it’s the anxiety I’m looking to reduce. 

I would rather replace damaging pharmaceutical drugs with a large amount of potential side effects with herbal cannabis for my ailments."
l6fntaw,Marijuana,anxiety,Some people spray a watered down formaldehyde solution on weed to make it seem much better than it is.  This can cause an array of negative symptoms especially if smoked on a regular basis👎💯❤️🤔just one thing I can think of but it could be a lot of other things I am not aware of as well.  If it’s anxiety take 10 days off symptoms should be long gone by then
l6wfie1,trees,"anxiety,worry",5. I live with constant anxiety worried I'm upsetting everyone. 5. Please. And thank you.
l7cudwq,Petioles,sleep,"I just quit a month and half ago and it took 3 weeks or so to get my sleep back to some semblance of normal. Still not as good as when I smoked /vaped but definitely better! You will get there too! The sleep hygiene routine helps as well but in my experience, you have to get over the 2-3 week hump first before anything really helps. I'd say CBTi is a good thing to try if you're still not sleeping in a couple of weeks. 

I also do yoga nidra in the afternoons as a form of mental maintanance but when I was not sleeping it was so helpful when I was trying to fall asleep or in the middle of the night when I couldn't get back to sleep. I read that you already exercise which is great. Keep us posted!"
l8304y9,CBD,anxiety,I only take 50mg and it’s helping anxiety so I’m going to keep using until I see negative effects
l8o6ga9,trees,dream,"Total recall (1990) cyborg(1989) bloodsport(1988)
Basketball diaries (1995) requiem for a dream (2000)"
lbaf18p,leaves,"nap,sleep,waking up tired","""Let me have a quick nap"" - I end up sleeping for 12 hours and then waking up tired"
lbhtwmv,leaves,stress,"I ride bmx & ebikes daily for stress, depression & to just get healthier, & it was 1 of the best decisions I've ever made in my life!

I started doing group rides here in Reno as well, & what's cool is most people in the bike life community all smoke as well, so it's just all good vibes, we all meet up, ride first to a corner store, get snacks, beer, wraps, whatever else, & then all ride to some different park every week, & all just hang out. 

I've met some great friends as well from doing this, & some of them are even like family to my son & I now! 👍"
lbllvv4,trees,pain,I plan on figuring out some kind of auto-watering system for this winter. That's definitely an issue I haven't dealt with yet. So far it hasn't been an issue because I rarely go anywhere overnight in the winter. I don't grow in peak summer because it's a pain to keep the humidity and temps down.
ldajkni,weed,worry,"
*Thanks for posting, u/Friendly2024.*

- Make sure you follow **[r/weed rules.](https://www.reddit.com/r/weed/wiki/rules)**

- Do not engage with ""vendors"" in your DMs and report those accounts in your chat and messages and also [here](https://www.reddit.com/report)

- Attempting to source drugs is against **SITE-WIDE** terms of services. an immediate, permanent ban will be imposed. 

- Don't resort to insulting other users, stirring up drama, or worrying about what's on someone's profile. Just report any posts/comments that you see breaks the rules.

- **[Info about scammers](https://www.reddit.com/r/weed/wiki/information/scammers)** 

- [Join our Discord](https://discord.gg/rweed)


*I am a bot, and this action was performed automatically. Please [contact the moderators of this subreddit](/message/compose/?to=/r/weed) if you have any questions or concerns.*"
ldg23pp,saplings,"inflammation,pain","Don’t smoke bro, the decreased blood pressure causes the veins to expand which could pop the stitches out. Nah but honestly you’ll be completely fine. Weed helps with inflammation and pain so it should help if anything"
ldy0ir0,microgrowery,headache,That's the only reason I have not switched to organic nutrients. Been hearing it's a headache
li9mqd2,leaves,pain,"You need to get yourself out there. Sounds like you put in the work to quit but not to improve yourself after. You started smoking for a reason that made you unhappy, or a myriad of reasons. Work on those! Feel your emotions. Remember what anger, annoyance, true joy does to you. And then embrace the pain, get yourself into interesting hobbies, take walks every damn day, and build up your emotional endurance so you don’t come crying to weed every time something slightly bad happens to you. Your emotional intelligence is at an all time low. You can change that by being better to yourself."
lihgyi8,weed,worry,"
*Thanks for posting, u/-DI0-.*

- Make sure you follow **[r/weed rules.](https://www.reddit.com/r/weed/wiki/rules)**

- Do not engage with ""vendors"" in your DMs and report those accounts in your chat and messages and also [here](https://www.reddit.com/report)

- Attempting to source drugs is against **SITE-WIDE** terms of services. an immediate, permanent ban will be imposed. 

- Don't resort to insulting other users, stirring up drama, or worrying about what's on someone's profile. Just report any posts/comments that you see breaks the rules.

- **[Info about scammers](https://www.reddit.com/r/weed/wiki/information/scammers)** 

- [Join our Discord](https://discord.gg/rweed)


*I am a bot, and this action was performed automatically. Please [contact the moderators of this subreddit](/message/compose/?to=/r/weed) if you have any questions or concerns.*"
liiuvgq,leaves,"panic,sleep","Same here, I’m a week clean and I was having nocturnal panic attacks, sobbing uncontrollably, hand tremors, appetite and sleep problems. 

It’s getting better, if I start to feel anything I immediately do 25 push ups, 25 sit ups, 50 jumping jacks and drink a glass of water and a hot cup of coffee. 

We can do this, on the upside I haven’t been coughing and spitting even 1/10th as much :D"
liwtnxc,leaves,paranoia,"Done a lot of drugs to manage my horrific childhood. 20 years ago quit and settled on the Mary Jane . Good lord the addiction! All the time ..never saw a reason to quit until I tried haha I really didn’t have a clue. What a powerful herb ! I have been loosing my power slowly or didn’t know I lost it . It always seemed like other people in my life noticed before me . The loosing it lost it part . 
In my opinion it’s a slow process to stop . This time I want it . 
I would get high af and go for walks and measure my feelings . My thoughts after the uneasy paranoia or numbness. I wrote it down . 
Writing about what I was gaining or missing in this space. 
So much time . Money . Brain power . 
Interesting that i brought myself into trying for one day to walk without to think without to do everything without it . Just one day . I wanted another day . 
I haven’t smoked since August 1
I’m loving it ."
