id,subreddit,keyword,text
doyyk0,Petioles,"anxiety,scared","Hello y'all, I'm new here looking for advice on a T break so I can get dumb high again and literally feel the anxiety leave my body. 

I've noticed that on here a lot of people feel guilty about using marijuana daily. I just want to post this to make you feel less guilty. Every teacher you ever had that you liked was probably really high, most of the time.  I am a senior in college studying education and I was scared that teachers can't smoke pot. But, from what I've learned from other teachers is that weed is the only way to deal with a shit job that no one thanks you for. And at the end of the day I am convinced that I will be a better teacher knowing that after class I can go home and smoke weed. Teachers don't get drug tested. NYC and Nevada have made it illegal to screen for marijuana for a job. We are making huge progress on marijuana reform. 

If anyone tells you that you are bad for using cannabis, they are a victim of decades of anti-marijuana propaganda that has been shoved down their throats since childhood. Reefer madness man. 

At the end of the day weed is great, if it helps you feel better about yourself than you should not feel guilty at all about your use. That's like feeling guilty when you take a Claritin or Tylenol. 

Stay medicated my friends."
eyyojt,CBDoil,"anxiety,pain",[https://www.latimes.com/lifestyle/story/2019-10-04/pets-cbd-pain-anxiety](https://www.latimes.com/lifestyle/story/2019-10-04/pets-cbd-pain-anxiety)
luwllj,CBDOilReviews,anxiety,"I'm looking for a broad spectrum CBD oil. I've tried a CBD isolate tincture from CBDistillery, as well as a broad spectrum one from cbdMD. 

The isolate oil did next to nothing for me, but the broad spectrum helped my anxiety quite a bit, which is what I use CBD for. 

I'm also open to something other than an oil/tincture, I've just heard that those are what is absorbed most quickly. I use CBD every day, and I would love something that is high concentration and comes in a bigger bottle, lol, because I've been having to order a 60ml bottle once a month. Still experimenting with dosages and different concentrations.

I suppose I'm seeking a CBD product that's as broad spectrum as possible (I seem to respond better to a combination of several cannabinoids, as I've heard most do) and has a high concentration of other cannabinoids. Lots of broad spectrum oils seem to have very little of those compared to the amount of pure CBD that they contain. However, I don't want to get high, as I use CBD during the day when I do things like driving/working. 

Bonus points if it's unflavored/plain.

**TL;DR: Looking for a broad spectrum CBD oil, with a high concentration of both CBD and other cannabinoids.**"
q7ysam,CBDOilReviews,anxiety,"Hi, I have a mild anxiety disorder - health anxiety + leaving home type, the recommended dose for me as some internet polls ( my therapist do not know that much regarding CBD, but she recommended me to use it, for the placebo and effect mixture) - is between 5-10 mg / day \[ most of them say 5\]. 

I found 2 companies :

But **eirhealth** have 300 and 600 mg, and **cbdreakiro** have the 500 mg type in 10ml bottles. 

Its my first time using CBD oil, should I go for any of these 2? or I can find something more suitable for me? 

Thank you."
qo4vud,CBDflower,"pain,sleep,worry","I am looking for advice.  I live in Madison County GA and in GA the sale, possession and distribution of CBD, Hemp bud and Delta 8 are legal.  But just this morning local city and county police raided each and every gas station and took all their CBD and hemp products.  To me this is a massive over reach by authorities who's narcotics team are a joke and love to make FB post every time they make a bust for a dime bag.  How do us in the community fight back against the overly heavy hand of the local sheriffs department in Madison county GA and local police like the Danielsville police department.  They gave no notice and raided all of the stores and treated business owners like criminals for selling something that is legal.  The narcotics officers have been bragging about them getting ready to make a move against business that sell CBD products.  

The majority of products sold at our stores are from well know manufactures with barcode tracking.  People my mom in particular loves using CBD gummies because they help with her arthritis pain and by taking them she can stay away from opioid medications that Drs like to push.  I guess it is ok for the pharma companies to push addictive drugs but not companies offering an all natural approach.  I know many of these business owners and they would never intestinally break the law.  I don't use CBD or THC products but many do and they are a far cry from the heavier life altering drugs out there.  Our back woods sheriffs department comprised of good ole boys and officers who like to sleep around on their wifes demonize anyone who use the products.  They put more effort into busting people for a little marijuana than they do in stopping the flow of Meth, heroin and fentanyl which has taken the lives of many in our county and first responders arriving at an overdose like to joke and treat it like ""there is one more dope head off the earth"".  This coming from first hand experience when my brother in law overdosed and despite my efforts and having Narcan on hand we were unable to save him.  Our county has it's priorities messed up when it comes to drug enforcement.  

I just want to put the Danielsville Police Department and The Madison county GA Sheriffs office on blast for what seems to be illegal search and seizures of products that are made legal through  HB. 213 the GA hemp farming act.  And any products containing less than 0.3%thc are legal for sale in GA including Delta-8 and others!  I am aware of some products testing higher and are of concern but our county is using a broad brush and from the outside looking in it looks to be illegal what they are doing.  I am just curious as to the thoughts of others.  I plan to post this in several groups to get the discussion rolling.  This is my first reddit post but it really touched a nerve with me.  And if you knew some of the officers on our counties narcotic team you would worry too."
zolbc8,Marijuana,anxiety,Took a 900 degree dab after cleaning the enail on accident. Thought it was on my normal temp. Will I be ok? I’m sorry for asking just suffer from bad anxiety.
c3nvtxb,trees,pain,"Here's a sauce for you [here](http://www.sciencedirect.com/science/article/pii/S0022395610001585#sec2.1), though I *highly* doubt you will read it, because bigots are usually stuck in their ways.


Seeing as scientists have gone to school for several years to study the brain, I sure as HELL respect scientists. They dedicate years of their lives on research. What have you used to form your opinion? Ignorance. I'd like for you to one day meet a transsexual and see the mental pain and social scrutiny they deal with everyday. 

People that are intolerant like you truly make me sick. At this point, you just don't want to be wrong about your opinion so you will fight your ways to the death. 

Perhaps if you put down your pride and had some human empathy you could see that transsexuals are real. They suffer everyday because people like you. This is r/Trees. Everyone here is supposed to be chill as fuck. You are embarrassing to humans."
c6chmhs,eldertrees,"anxiety,paranoia","I only suffer from paranoia when I'm high. Thought, to be fair, I have had bouts of anxiety in the past. Usually paranoia sets in if I'm in a new environment. If I am drinking and smoking I don't suffer paranoia at all."
c7pnpat,leaves,worry,"I'm not going to lie - this is exactly the way I see weed as well.  I'm fine with the amount I'm smoking, but my big worry is that I won't have the willpower to not smoke while looking for a job after I finish university.  I'm pretty sure I'll be fine, but there's always that nagging feeling. "
c7s79ae,eldertrees,"sleep,slept","I feel like 72 hours/3 sober days & nights is a quick but very effective breather that many of us could strive for.

I went on a 4-5 day TB, and I would say after my third night that day 4, similar to the OP, I felt like a new man. My appetite resumed and I slept regularly without having to use OTC sleeping medications.

I hate to phrase this way, but being sober felt like ""being high"" almost. Being sober a day after you toked and being sober after a TB are two different animals I'd say.

Earlier in the year, I went on a 3-4 month TB for a job (which didn't even end up testing me!), but it was important for me to prove to myself that I could theoretically live without it and that I was above addiction to it, that it was my hobby but not the defining point of my lifestyle.

I think it's good for all ents to take an occasional TB, it really helps to put things in perspective and I think you end up having a better relationship with the herb in the long run too.

But, well, that's just like my opinion, man."
c9uooiw,eldertrees,anxiety,"Ive noticed I sometimes get ""whiskey mouth"" and by that I mean my speech gets slurred and lazy. I almost have to make a conscious effort to form my words. Made me feel very embarrassed when people would notice. Not good for anxiety."
ce4oy0m,entwives,worry,"WTF comment graveyard.  Ha.  I'm always so damned curious!

Anyway, congratulations!!!  That's very exciting.  And you'll be able to enjoy the height of your pregnancy during the warmer months!  There's some back and forth on which is better, but a friend of mine was thrilled that when her feet swelled, she could just wear flip flops and not worry about it.

Again, congratulations!!!"
ceviq0l,eldertrees,dream,"what i would have given to have someone there stand up and somehow clearly state this exact phrase to obama....

one can dream."
chi25cy,eldertrees,stress,"I wouldn't say we're bashing alcohol here, more getting the facts straight, by given the level of bullshit and stress prohibition has caused everyone here, there will certainly be an inescapable amount of indignation for this specific article. 

That general sense of proving a loud asshole wrong with irrefutable facts after they run their mouth against you is simply too satisfying to not cash in on at least a little ;)"
csmqntb,eldertrees,worry,"I can understand in childcare or education, it makes sense. But I'm honestly more worried about, for example, a heroin addict teaching children than someone who habitually smokes marijuana cigarettes. So I do see why it's there, but the stigma against pot smokers still stands. I've felt it was more about not allowing people to smoke weed than actually keeping people safe from drug addicts..."
ct9uhk4,eldertrees,suffering,"trollin is a release and spread of negativity because it has become to much for the host. to end trollin is to underatand it, and to understand it is to know its unstoppable but can be easily minimized by knowing the person on the other end is suffering and has no other outlet "
cwkn7ge,eldertrees,pain,"I've been a cannabis consumer for most of my adult life. I dont medicate all day, usually just at night. I consider it a mood enhancer for entertainment and outdoor experiences. But I also believe it has therapeutic benefits, such as alleviating muscle pain after hikes and workouts. I also think that its therapeutic as a possible remedy for things like glaucoma, alzheimers and maybe some cancers, though that remains to be proven. I never liked the social stigma of smoking, so I switched to vaporizers about 3 years ago and its made a tremendous difference."
d374wcj,trees,suffering,"""People suffering from severe drug addiction don't deserve assistance,"" he says on a forum dedicated to smoking weed."
dae9lcv,eldertrees,"anxiety,sleep",Aside from the dad stuff you sound like me. And I agree - I hold down a good job with a good pay so sue me if I want to smoke to help settle my anxiety and sleep :)
deszimi,trees,"anxious,paranoia","That sounds cool, dude. I'm fairly socially anxious sober, so that coupled with the paranoia that the high brings me I become a wreck among people, unless I'm in comfortable company. Drinking diminishes it heavily though, but I don't like being drunk.."
dk3mo53,CBD,pain,"It can kill tumor cells of SOME types of cancer in a petri dish, but so can soap.  There haven't been many scientific studies on its effects in the human body against cancer.  What there have been are a lot of wild claims and anecdotal reports of it curing ""incurable"" cancers and the like.

I see nothing wrong with using cannabis in conjunction with proven therapies to treat cancer, but I've heard of people foregoing chemo/radiation in favor of cannabis, which is a giant mistake in the majority of cases.  Cancer isn't one disease but many, with each type behaving differently.  If ""mainstream"" medicine can effectively treat your cancer and you choose against it, you've just signed your own death certificate.  (Steve Jobs, anyone?)  Bob Marley decided against surgery to remove his cancerous toe & chose to ""let Jah heal me wit' da meditations of me chalice pipe"" and we see how that turned out :(

Cannabis can help greatly with the SYMPTOMS of cancer, such as nausea, pain & appetite suppression.  But until they develop a targeted & evidence-based cancer therapy using cannabis, I wouldn't put much stock in it.  There's potential but there will be no miracle cures for the hundreds of types of cancer that exist.  (Not claiming that's what you're saying, OP.  Just speaking generally).  "
drgf6vu,trees,hurt,"Yeah, I used to feel that way. But over the past few years I’ve moved away from that idea entirely. I don’t think I have to say a prayer for a god to know when I need help. What’s out of my control is not going to be influenced by me praying. It’s never had an effect so it doesn’t make sense to expect something out of it when the stakes are higher. I don’t blame people who want to be on the safe side, but you can’t tell what the safe side is. Maybe we’re praying wrong, maybe that only hurts our chances. Who knows. "
e75a2j7,trees,"anxiety,panic","Yeah man, like the other day when i managed to fend off that panic attack, i thought ""fuck yeah, i've beat depression and now i can beat anxiety too"" i felt quite proud and mentally strong."
e8j2yk6,CBD,"anxiety,pain",Yep most of the videos are chronic pain athletes and fat white women who complain about anxiety lol 😂 
e9f35t8,trees,hurt,"I fuckin hate edibles, they don’t work for me (I’ve tried probably about 8 times). However AVB seemed to have a pretty good effect, granted I smoked with it too.

I honestly thought it was just a brownie when I looked.

My brain:
“Yeah I love weed, mhm brownies take a long time to cook so we have to wait I guess, and dabs hurt when they’re too hot, this meme is pretty good” "
ec16nu5,Marijuana,hurt,"Really depends on the strain they are getting. When seperated most don't cause you to get high and have proven medicinal value but clearly if your hitting a bong with pure pot, you should not get a firearm. At that point I wouldn't trust you with a fork. If it helps,they will be in their moms basement, 50 years old and couldn't afford one. If they could the only person they would hurt would've themselves and isn't that Darwins theory of evolution anyway?"
eckeido,trees,panic,Or can’t smoke anymore because it’s gives me panic attacks 
ehrv7ky,Petioles,"pain,throbbing","Okay first of all I love the way you put things, it's accurate as fuck. It's the first thing, I'm still smoking right now (but I've been cutting down, distracting myself, hands slowly getting better) but i just ran out of shatter. So it's reclaim until i slow down even more. 

But you're right, sadly it's not a break, it's a finger tendon surgery so my ring finger needs to be exercised (gently with my other hand, to stretch it) every hour, and any kind of touch to my finger feels fucking weird. Like half numb, throbbing pain inside sometimes. But you're right, and I have been doing more (inside) exercise for my legs. I'm starting to struggle to fall asleep at night, but it's not the end of the world. Thanks for the wishes man. still can't believe how accurate your comment is. "
etdm5o6,MMJ,pain,My neurologist is a pain management doctor.
f04auhp,Marijuana,overwhelmed,"Trump is in an ideal position.  
1 the democrats cannot seem to find any realistic candidates.  Shocking to me as they have had 4 years to sort that out...

2 The economy is doing great, with the only hold back being the China trade war.  Trump can end that all on his own at any time.  Which I suspect he will when the time is right.  Which will also provide a bump to the markets and economy.

3 I bet he will be the guy to sign the law that weed is off the schedule 1 list.  I suspect it will happen next fall, weeks before the election.

I think the combo of those three things, timed right, plus his overwhelming financial advantage (and lack of
Primary fight) will mean 4 more years of Trump."
f05nplm,weed,fear,"Prices are expected to rise, yes, you are correct. But as everyone is recieving the income, if you raise your prices too high you will lost A LOT of business. Because it's universal, you know everyone you see is receiving it. so if you went to a store and they were charging extortionate prices - you wouldn't buy anything from there. This applies to landlords as well, they won't increase their prices due to the fear of other people not doing it. 

And the higher minimum wage is morally really good, but once put into practice it would not be beneficial. Firstly, small business would get absolutely destroyed. Most small businesses now are running on tight margins. If these business owners had to start paying people 15 dollars an hour all of a sudden it would be a financial burden to the owner. They would cut hours, get rid of employees in order to ensure that there's enough money to put food on their table first. Also, with a higher minimum wage what would happen to those that have their jobs automated? Higher minimum wage pushes for automation to happen faster, UBI does not. Higher minimum wage doesn't help people who have had their jobs automated or the people that cannot work. Also, what about people that are recieving above 15$ an hour but are still struggling to pay bills etc. there's nothing in place for these people. Why not ease the burden on everyone with UBI because eventually it will be needed no matter what. It's better to prepare instead of react."
f5v2tnb,weed,sleep,"So, my mom is pretty cool, very open minded, I’m a fan of acid and I’d been telling her about the benefits and how it’s had beifited me. So she asked if I’d give her a low dose, at the time I had 3 sheets so I didn’t mind, so I cut one of the weaker ones in half and gave her all the safety precautions and suggestions and let her have fun, she laid in her room for 5 hours and played on her phone and cuddled with the cat, she said she felt more calm than she had in years and that it was a good experience but would not be interested for a while because it lasted way too long and she couldn’t sleep(100% agree that’s the main downside to acid). I remember going to check on her and she said I looked like a cartoon character lol. She texted me many many acid thoughts and listened to Pink Floyd and the beetles the whole time. She’s interested in mushrooms but is terrified of salvia and DMT because she had a wacky ass trip on Salv in her 20s. She a cool mom"
fibpg81,CBD,pain,My ex-wife had endometriosis was prescribed tylenol + codeine. Wasnt enough for the pain and ended up leading into hard drugs just to deal with her pain. They have methods of treating endometriosis now in the usa but I am sure they are entirely surgical. Opioid painkillers are a rabbit hole you dont want to go down especially for a pain that is going to be there at certain times whether you take them or not. Of course you could use hard drugs to bury the pain but then you will have far more problems than you are already dealing with. I found Kratom to be not very effective for serious pain. Tylenol is ok but it's like anything if you keep using it you get used to the effect. So if your doc cant refer you to a specialist to see if they have other options for you then it might be time for a new doctor.
fiuuya5,Marijuana,worry,">Today I've seen 80%+ THC on buds I'm buying.

You might be seeing those numbers on live resin concentrates, but typically 30ish percent is the ceiling on flower. I understand your enthusiasm but if your source is selling you 80% THC flower, you might want to think about what else he might be fibbing about.

Personally I don't worry too much about THC levels, I find that lower THC weed that is fresher and has the smell my body wants gets me higher than ""high test"" weed that is old and has no smell.  The nose knows."
fok9up2,leaves,pain,"I'm so very sorry for your loss. Your dog looked like a very sweet, good girl and I'm sure everyone on the planet knows how horrifying and painful it is to lose a pet. Loss is the perfect excuse we give ourselves to relapse to our old destructive habits. Death unfortunately is a sobering, crushing part of life that we all have to deal with and doing it drunk and high is not dealing with it. It's just burying the pain and guilt deep down until your sober again. For you to care this much about your dog, shows that you most likely did as much and showed as much love as you possibly could to this animal and I'm sure she knew that. All u can do now is remember that you made her happy and go on to make others happy."
fqnxoef,trees,paranoia,"Not a win, but a **huuuuuge** improvement.  I can get baked legally.  As a middle aged fart I spent many years dealing with black market, shit weed, zero strains to choose from.  Cops who wanted to charge you like a drug lord when they find a baby roach.  All of that sitting on your shoulders as you get baked, just begging to ramp up the paranoia, at least enough to chill out what was a wonderful buzz.  

Don't stop the fight!  It must be legal!  But sometimes sit back as you're enjoying a legal MMJ high and realize, this is a very, very good start."
fwdyls5,microgrowery,worry,Yes. It was my first harvest and I guess it’s a “thing” but once you trim put them into jars and burp every day twice a day for a week then once a day the following week. By the third week your buds will start to get their smell back and it will smell dank. I was worried too because my stuff smelled like hay/grass but now it smells amazing. I open up the jars and it instantly stinks up the room. Keep repeating the process over time it will get better. Good luck!
fwkf565,cannabiscultivation,"sleep,slept","God dang y’all! Im so jealous. In Cali I had it made since I got my MMJ card in 2014. Now (no pity party insinuation) I’ve had to move to a state to handle my father suddenly passing away, along with some VERY questionable circumstances of which I may not speak about until, things settle... anyway: I’m literally stuck in a state w/out access to either types of legit MMJ or rec and the only available (from street) is the worst crap I’ve ever seen/experienced in my life. What’s worst is that they consider it “that chronic” and outstanding. Literally, have no idea what they have. I bought ”9 lb hammer” but it hit more like a plastic spoon. 

I had a friend sending cartridges but he was deployed again. (We we’re stationed in Thousand Palms together for several years). Now, he’s stuck overseas for a minimum of 6 months. So...Long story short: my plants are likely dead (at my home in so cal...and I certainly can’t leave during this time as we have several civil cases pending my father’s estate and wrongful death suit. 

Anyway: folks...please: what are my options? FYI I’m in Mississippi. (I also use VPN/onion browsers/every precaution necessary). No access to anything whatsoever and I literally haven’t slept a full night since I have been without my granddaddy purple/SFV OG Kush, oh Lord, I’m relaxing just thinking about them. Most likely, it’s partially due to tragic death of my father, however, even when I do sleep it’s sporadic. So: I genuinely need to find a way to get access to seeds, clones, anything...Anyone reading will know as to which types of items I’m referring. mJ Crimea have been decriminalized here so it’s not a big deal...however, I’m not one to flagrantly display a blatant disregard for laws. So: I’m desperate and open to suggestions! Anyone who regularly partakes knows the effects of abruptly stopping...I’m Truly needing serious advice, no bs. Unless it’s truly funny lol! Oh yeah-I’m in no way associated with nor have I ever been nor will I ever be associated with or any part of any govt agency or even anything related to that type of activity. That’s my roundabout way of saying what I’m not without using keywords. PM if you have doubts lol! Just a broke ass grad student whose father passed away unexpectedly...ok maybe that’s a little too whiny but still: getting the point across. It’s quite obvious I haven’t spoken to anyone about this bc I’ve rambled and created an embarrassingly long post! Any help is appreciated! 
-A fellow friend devils lettuce lover,
C"
fwl4qyd,leaves,anxiety,"Really well done for doing it! Weed dependancy is no joke and we are strong💪🏻 I felt the same in terms of the anxiety/depression, feeling like weed levelled me out and made me feel human but when your high it’s hard to see.  I’m 9 days in and I feel like a new man, a better version of myself.
Good luck, stay strong and again well done🙌🏻"
